<?xml version="1.0" encoding="UTF-8"?>
<data xmlns="http://www.TRList.com" xmlns:xsi="http://www.w3.org/2001/XMLSchema-instance"
          xsi:schemaLocation="http://www.TRList.com data.xsd">
    <label>
        <uid>1</uid>
        <uid>2</uid>
    </label>
    <project>
        <uid>3</uid>
    </project>
    <priority>
        <uid>4</uid>
    </priority>
</data>
